{
  "client_instance_id": "plugin_01K7EXAMPLE00000000000",
  "vault_id": "vault_01K7EXAMPLE0000000000000",
  "vault_fingerprint": "sha256:example",
  "bootstrap_proof": "synthetic-one-time-proof",
  "public_key": {
    "kty": "EC",
    "crv": "P-256",
    "x": "synthetic-x-coordinate",
    "y": "synthetic-y-coordinate"
  }
}
